{
  "catalogVersion": "1.0.0",
  "designSystem": { "name": "bootstrap", "bootstrapVersion": "5.3" },
  "tokens": {
    "spacing": ["none", "xs", "sm", "md", "lg", "xl"],
    "width": ["auto", "full"],
    "align": ["start", "center", "end", "stretch"],
    "size": ["sm", "md", "lg"],
    "variant": ["primary", "secondary", "success", "warning", "danger", "info", "light", "dark", "link"]
  },

  "commonPropSets": {
    "baseNode": {
      "description": "Standard non-styling props for all nodes.",
      "propsSchema": {
        "type": "object",
        "additionalProperties": false,
        "properties": {
          "visible": { "type": "boolean", "default": true },
          "disabled": { "type": "boolean", "default": false },
          "readOnly": { "type": "boolean", "default": false }
        }
      }
    },
    "layoutHints": {
      "description": "Bootstrap-safe layout hints; no raw className/style.",
      "propsSchema": {
        "type": "object",
        "additionalProperties": false,
        "properties": {
          "spacing": { "type": "string", "enum": ["none", "xs", "sm", "md", "lg", "xl"], "default": "md" },
          "width": { "type": "string", "enum": ["auto", "full"], "default": "full" },
          "align": { "type": "string", "enum": ["start", "center", "end", "stretch"], "default": "stretch" }
        }
      }
    },
    "inputBase": {
      "description": "Shared props across all input components.",
      "propsSchema": {
        "type": "object",
        "additionalProperties": false,
        "required": ["id", "name", "label"],
        "properties": {
          "id": { "type": "string", "pattern": "^[a-z][a-z0-9-]*$" },
          "name": { "type": "string", "pattern": "^[a-z][a-z0-9_.-]*$" },
          "label": { "type": "string", "minLength": 1 },
          "required": { "type": "boolean", "default": false },
          "placeholder": { "type": "string" },
          "helpText": { "type": "string" },
          "size": { "type": "string", "enum": ["sm", "md", "lg"], "default": "md" },
          "autocomplete": { "type": "string" }
        }
      }
    }
  },

  "components": [
    {
      "type": "FormContainer",
      "category": "layout",
      "version": "1.0.0",
      "description": "Top-level form wrapper with submit lifecycle and error summary.",
      "acceptsChildren": true,
      "childPolicy": { "allowedChildTypes": ["Grid", "Section", "Alert", "Divider"], "minChildren": 1 },
      "dataBinding": { "bindable": false, "valueType": "unknown" },
      "propsSchema": {
        "type": "object",
        "additionalProperties": false,
        "required": ["formName"],
        "properties": {
          "formName": { "type": "string", "minLength": 1 },
          "mode": { "type": "string", "enum": ["create", "edit"], "default": "create" },
          "state": { "type": "string", "enum": ["idle", "loading", "success", "error"], "default": "idle" },
          "showErrorSummary": { "type": "boolean", "default": true }
        }
      },
      "rules": {
        "a11y": { "requiresLabel": false, "supportsHelpText": false, "supportsErrorText": true },
        "defaults": { "showErrorSummary": true, "state": "idle" },
        "constraints": []
      }
    },

    {
      "type": "Grid",
      "category": "structure",
      "version": "1.0.0",
      "description": "Responsive Bootstrap grid container.",
      "acceptsChildren": true,
      "childPolicy": { "allowedChildTypes": ["GridRow", "Section", "Divider"], "minChildren": 1 },
      "dataBinding": { "bindable": false, "valueType": "unknown" },
      "propsSchema": {
        "type": "object",
        "additionalProperties": false,
        "properties": {
          "gutter": { "type": "string", "enum": ["none", "sm", "md", "lg"], "default": "md" }
        }
      },
      "rules": {
        "a11y": { "requiresLabel": false, "supportsHelpText": false, "supportsErrorText": false },
        "defaults": { "gutter": "md" },
        "constraints": []
      }
    },

    {
      "type": "GridRow",
      "category": "structure",
      "version": "1.0.0",
      "description": "Row wrapper for columns.",
      "acceptsChildren": true,
      "childPolicy": { "allowedChildTypes": ["GridCol"], "minChildren": 1 },
      "dataBinding": { "bindable": false, "valueType": "unknown" },
      "propsSchema": { "type": "object", "additionalProperties": false, "properties": {} },
      "rules": {
        "a11y": { "requiresLabel": false, "supportsHelpText": false, "supportsErrorText": false },
        "defaults": {},
        "constraints": []
      }
    },

    {
      "type": "GridCol",
      "category": "structure",
      "version": "1.0.0",
      "description": "Bootstrap column with breakpoint spans.",
      "acceptsChildren": true,
      "childPolicy": {
        "allowedChildTypes": [
          "Section",
          "TextInput",
          "TextArea",
          "NumberInput",
          "DateInput",
          "Select",
          "Checkbox",
          "ChoiceGroup",
          "Button",
          "Alert",
          "Divider"
        ],
        "minChildren": 1
      },
      "dataBinding": { "bindable": false, "valueType": "unknown" },
      "propsSchema": {
        "type": "object",
        "additionalProperties": false,
        "properties": {
          "xs": { "type": "integer", "minimum": 1, "maximum": 12, "default": 12 },
          "sm": { "type": "integer", "minimum": 1, "maximum": 12 },
          "md": { "type": "integer", "minimum": 1, "maximum": 12 },
          "lg": { "type": "integer", "minimum": 1, "maximum": 12 }
        }
      },
      "rules": {
        "a11y": { "requiresLabel": false, "supportsHelpText": false, "supportsErrorText": false },
        "defaults": { "xs": 12 },
        "constraints": []
      }
    },

    {
      "type": "Section",
      "category": "structure",
      "version": "1.0.0",
      "description": "Section header with title/description; can contain inputs.",
      "acceptsChildren": true,
      "childPolicy": {
        "allowedChildTypes": [
          "Grid",
          "GridRow",
          "GridCol",
          "TextInput",
          "TextArea",
          "NumberInput",
          "DateInput",
          "Select",
          "Checkbox",
          "ChoiceGroup",
          "Divider"
        ],
        "minChildren": 0
      },
      "dataBinding": { "bindable": false, "valueType": "unknown" },
      "propsSchema": {
        "type": "object",
        "additionalProperties": false,
        "required": ["title"],
        "properties": {
          "title": { "type": "string", "minLength": 1 },
          "description": { "type": "string" },
          "spacing": { "type": "string", "enum": ["none", "xs", "sm", "md", "lg", "xl"], "default": "md" }
        }
      },
      "rules": {
        "a11y": { "requiresLabel": false, "supportsHelpText": false, "supportsErrorText": false },
        "defaults": { "spacing": "md" },
        "constraints": []
      }
    },

    {
      "type": "Divider",
      "category": "structure",
      "version": "1.0.0",
      "description": "Visual separator with safe spacing tokens.",
      "acceptsChildren": false,
      "dataBinding": { "bindable": false, "valueType": "unknown" },
      "propsSchema": {
        "type": "object",
        "additionalProperties": false,
        "properties": {
          "spacing": { "type": "string", "enum": ["none", "xs", "sm", "md", "lg", "xl"], "default": "md" }
        }
      },
      "rules": {
        "a11y": { "requiresLabel": false, "supportsHelpText": false, "supportsErrorText": false },
        "defaults": { "spacing": "md" },
        "constraints": []
      }
    },

    {
      "type": "TextInput",
      "category": "input",
      "version": "1.0.0",
      "description": "Single-line input supporting different input types via a constrained enum.",
      "acceptsChildren": false,
      "dataBinding": { "bindable": true, "valueType": "string" },
      "propsSchema": {
        "type": "object",
        "additionalProperties": false,
        "required": ["id", "name", "label"],
        "properties": {
          "id": { "type": "string", "pattern": "^[a-z][a-z0-9-]*$" },
          "name": { "type": "string", "pattern": "^[a-z][a-z0-9_.-]*$" },
          "label": { "type": "string", "minLength": 1 },
          "required": { "type": "boolean", "default": false },
          "placeholder": { "type": "string" },
          "helpText": { "type": "string" },
          "size": { "type": "string", "enum": ["sm", "md", "lg"], "default": "md" },
          "autocomplete": { "type": "string" },

          "inputType": { "type": "string", "enum": ["text", "email", "tel", "url", "password"], "default": "text" },
          "minLength": { "type": "integer", "minimum": 0 },
          "maxLength": { "type": "integer", "minimum": 1 },
          "pattern": { "type": "string" }
        }
      },
      "rules": {
        "a11y": { "requiresLabel": true, "supportsHelpText": true, "supportsErrorText": true },
        "defaults": { "inputType": "text", "size": "md" },
        "constraints": [
          {
            "id": "textinput-no-password-autocomplete-off",
            "severity": "warn",
            "when": { "propEquals": { "prop": "inputType", "value": "password" } },
            "message": "Password fields should specify autocomplete. Default to 'current-password' if unknown.",
            "suggestedFix": { "setProps": { "autocomplete": "current-password" } }
          }
        ]
      }
    },

    {
      "type": "TextArea",
      "category": "input",
      "version": "1.0.0",
      "description": "Multi-line text input.",
      "acceptsChildren": false,
      "dataBinding": { "bindable": true, "valueType": "string" },
      "propsSchema": {
        "type": "object",
        "additionalProperties": false,
        "required": ["id", "name", "label"],
        "properties": {
          "id": { "type": "string", "pattern": "^[a-z][a-z0-9-]*$" },